<xs:schema xmlns:xs="http://www.w3.org/2001/XMLSchema">
    <xs:element name="persona">
        <xs:complexType>
            <xs:sequence>
                <xs:element name="nombre" type="xs:string" />
                <xs:element name="mujer" type="xs:boolean" default="false" />
                <xs:element name="fecha_de_nacimiento">
                    <xs:complexType>
                        <xs:sequence>
                            <xs:element name="dia" type="xs:integer" />
                            <xs:element name="mes" type="xs:integer" />
                            <xs:element name="anyo" type="xs:integer" />
                        </xs:sequence>
                    </xs:complexType>
                </xs:element>
                <xs:element name="ciudad" type="xs:string" />
            </xs:sequence>
        </xs:complexType>
    </xs:element>
</xs:schema>